saya bangga terhadap jokowi meskipun memang pilpres sudah dekat , beliau ke banten tidak hanya untuk kampanye tetap tetap bekerja .	positive
suka makanan yang menantang ? yuk dicoba ini ! lokasi nya di dipati ukur dekat unpad dan stikom . wow , maka dari itu tempat ini digandrungi mahasiswa dan muda mudi . ajak pasangan mu ke sini yuk . harga nya cocoklah buat kantong mahasiswa	positive
bebek garang di braga ini tempat nya tidak terlalu luas . sering penuh kalau sedang waktu makan siang jadi kalau berniat ke sini sebaiknya datang sebelum waktu istirahat siang . pelayanan nya lumayan cepat . di setiap meja disediakan permainan dadu dan monopoli yang bisa dimainkan sambil menunggu pesanan datang . daging bebek nya empuk dan gurih . bumbu nya terasa meresap sampai ke daging bebek . harga nya juga tidak . lanjutan	positive
enak nih kalau di sini steak nya apalagi burger nya , lokasi nya strategis pakai tempat nongkrong juga bisa soal nya dekat kampus juga	positive
mi yang sudah menjadi legenda di kota bandung . saya sangat suka yamien nya . harga lumayan mahal untuk bakmi tapi sesuai dengan rasanya .	positive
salah satu kafe yang mengusung tema shabby . menyenangkan baik untuk yang sudah berkeluarga ataupun pasangan . ada menu spesial di sini yang cukup menarik . disarankan anda membawa beberapa teman untuk membantu anda menghabiskan nya . justru disitulah keseruan terjadi . yup cobalah menu burger hitam super besar kira-kira berdiameter 16 cm .	positive
saya awal nya memutuskan masuk ke restoran ini karena dari depan terlihat unik . terlihat seperti bis , yang oleh orang bandung disebut bandros . suasana di dalam nya pun sama unik nya , dan disalah satu dinding nya ada coretan walikota bandung , bapak ridwan kamil . makanan di sini juga unik dan enak serta harga nya pun menurut saya tidak terlalu mahal .	positive
rekomendasi untuk makan siang ala indonesia , pilihan makanan nya banyak sekali tinggal tunjuk saja . terbanyak yang bentuk gorengan , misalnya empal , ayam goreng , tahu goreng dll. peralatan makan yang dipakai yang ala model zaman dulu , seperti piring seng , gelas seng , mengingatkan makan di zaman dahulu . pelayanan cepat . mantap	positive
sangat enak tempat nya , mungkin bisa untuk nongkrong dengan biaya mahal atau makan malam keluarga . tempat ini menyediakan steak dan makanan barat . berada di dago pakar anda bisa melihat keindahan kota bandung dari sini .	positive
restoran ini bukan sekadar tempat makan biasa , tapi juga bisa dijadikan tempat wisata karena memang terletak di daerah lembang , bandung . lokasi nya sangat dingin , tempat nya juga bagus , nyaman , dengan pemandangan yang eye catching . menu yang disediakan juga beragam dengan rasa yang enak . tidak perlu menunggu lama dalam penyajian makanan nya . harga juga relatif terjangkau . untuk tempat berfoto juga bagus .	positive
kami makan di roof kafe yang ada di seberang resor nya dan berada di atas restoran suki nya . tempat nya bagus dan penataan nya cantik sekali . kalau datang bersama pasangan sangat romantis sekali suasa nya di sore hari . tempat ini hanya buka sampai jam 20.00 saja . cocok nya datang sekitar jam 17	positive
setiap ke sini pasti order green tea frappio dengan pearl . tidak pernah mengecewakan . makanan kesukaan di sini itu sandwich nya dan ikan dori sambal sereh . sambal sereh nya paling enak sejagad raya !	positive
ini kesekian kali saya mengunjungi restoran ini dan seperti kunjungan sebelumnya , tempat ini selalu memuaskan . menu nachos misalnya , adalah salahsatu yang terbaik di kota . di banyak resto , kadang menu nachos tidak sesuai harapan saya , tapi di sini percis seperti apa yang saya cari dan idamkan . nachos disajikan dengan presentasi menarik dan pilihan 3 saus : guacamole , sour cream dan salsa . sempurna ! sekali . lanjutan	positive
tidak pernah bisa bicara kata-kata kasar ke pasangan walau tujuan nya bercanda / memang lagi marah banget karena saking respek nya saya ke dia	positive
oleh-oleh nya yang disediakan di sini cukup banyak sih . mau model keripik-keripik . sampai minuman-minuman khas bandung banyak . banyak cabang nya juga sih sari raos .	positive
restoran ini terletak sekitar 500 m dari hotel . menu makanan khas sunda ala tradisional dengan harga yang relative murah . menu makanan mulai dari makanan nasi , lalapan , ikan bakar , ikan goring , tahu dan tempe , rending , ampela ati , daging empal dsb. minuman aneka jus , teh , ronde dan minuman kesehatan lainnya .	positive
tempat yang nyaman dan alami untuk membawa keluarga relaks suasana pedesaan alami . mengenalkan anak pda alam	positive
tidak rasis	positive
stasiun gbk setelah diperbaiki menjadi sangat megah	positive
mencari restoran yang tidak pakai msg terus dapat info kalau lumboenk kafe tidak pakai msg jadi ke sana deh . nyobain stuffed chicken nya dan caisim nanas jus ternyata enak banget . jempol deh	positive
saya tidak kecewa dengan prabowo	positive
begitu masuk resto ini sudah tercium bau yang khas mengundang selera untuk makan . sate yang disajikan masih segar . selain daging kambing tersedia daging sapi dan daging ayam . selain sate ada menu yang lain seperti gule , tongseng dan sop sumsum . sate kambing nya sangat nikmat dengan pilihan saus kacang dan sambal kecap dengan irisan cabe rawit . daging nya terasa lembut dan bau kambing nya . lanjutan	positive
menu nya banyak sehingga tidak bakal kekurangan pilihan . khas sunda banget . semua lauk bisa di panaskan terlebih dahulu . nasi nya selalu hangat , jadi bila makan malam hari atau tengah malam pasti tetap enak . hati hati bagi pengunjung bukan orang jawa barat , sambel nya kencur banget . takut nya bagi yang tidak suka kencur nanti kecele karena penampilan sambel nya mengoda banget .	positive
bebek nya enak , lembut , sambel nya enak . tapi minuman nya terrible . saya order es jeruk , berharap dapat jeruk alami , tapi yang keluar semacam nutrisari . pelayanan biasa saja , tempat bersih dan lumayan oke .	positive
bu risma , saya rindu ibu , saya senang bisa memiliki pemimpin seperti ibu	positive
bisa makan sepuas nya bersama teman-teman , santai dan makanan nya juga enak dan segar	positive
bakso dengan ceker atau kaki ayam merupakan sensasi yang menakjubkan . enak banget deh pokok nya selain bakso masih banyak menu yang lain . pokok nya direkomendasikan banget deh	positive
berada persis di depan braga citi walk , resto ini ramai di malam hari . resto ini mengangkat tema vintage , salah satu keunggulan nya adalah live music yang menurut saya asik , serasa di bawa ke bandung tempo dulu .	positive
datang pas malam suasana keren banget ada ibu-ibu yang ngegrup pada bernyanyi-nyanyi di tempat ini . harga juga tidak terlalu mahal untuk menu-menu tradisional	positive
hampir sama deh semua pizza rasanya , hanya mungkin dari roti nya agak tipis dan rasanya sama dengan pizza yang lainnya . ada pasta juga yang rasanya juga enak bumbu dan ayam nya banyak , sekeluarga paling suka dengan pizza makanan ringan yang simpel dan mengenyangkan .	positive
selalu bikin kangen kalau ke bandung . sate kulit nya favorit ku , cobain deh . porsi nya besar , untuk ukuran perempuan 5 tusuk sate plus lontong saja sudah mengenyangkan . dicoba juga sate sapi nya .	positive
untuk yang sedang ke bandung dan cari tempat yang enak parkir nya dan makanan nya butuh cepat , lebih baik ke sini karena parkiran luas dan suasana nyaman	positive
tempat nya di gedung kartika sari dago yang tempat beli oleh-oleh khas bandung itu . makana nya komplet asia makanan barat . saya pesan nasi campur bali enak . yang enak lainnya kolak candil pisang nya . plus nya di sini ada tempat bermain anak nya . jadi cocok sekali tempat makan ini buat keluarga yang punya anak .	positive
lokasi dekat tempat wisata belanja oke . dari luar kelihatan kecil tapi begitu masuk , dengan lorong di kanan banyak ruangan bisa dipilih . teras belakang yang terbuka dan cukup luas banyak juga pilihan tempat dan cukup nyaman untuk menikmati makanan sambil mengobrol . menu yang ditawarkan tidak terlalu banyak dengan harga yang terjangkau .	positive
saya mencoba themed makan malam yang selalu diadakan di hari sabtu malam . us hitam angus op ribs buffet makan malam . black angus - nya lezat , pilihan saus yang variatif dan rasa yang menarik . wine selection - nya lengkap , marinated finger ribu nya juga enak . pilihan pasta , salad , dan makanan penutup yang benar-benar memanjakan lidah . rekomendasi !	positive
tempat nya sih di dalam kawasan cihampelas walk , salah satu mal anak muda di bandung . tempat nya enak buat nongkrong karena ada sofa nya juga . jadi kalau lagi menyantet enak deh . makanan nya juga enak-enak dan harga terjangkau . maka dari itu banyak abg di sini . lumayan buat cuci mata , hee .	positive
saya bersama keluarga pergi ke kampung daun tapi karena ramai nya maka harus antre kira kira 10 orang dengan waktu antri kurang lebih 30 menit cukup lama tapi begitu bisa masuk terbayar dengan makanan nya yang enak dan pemandangan yang indah ditambah harga nya masih terjangkau . selanjutnya tim saya akan berkunjung lagi ke kampung daun .	positive
bakso adalah makanan yang sangat populer di indonesia . makanan yang berupa bola daging dengan kuah panas ini merupakan makanan yang diadopsi dari kuliner cina . hampir setiap daerah di indonesia memiliki varian bakso yang berbeda . salah satu nya adalah tuan ki . varian bakso yang berasal dari kota kembang bandung ini sepintas nama nya mirip masakan cina .	positive
nilai plus	positive
kedai kecil yang menyajikan makan makanan ringan . ada bakso tahu , dan aneka roti kukus . mereka juga menyajikan kopi . lengkap .	positive
steak di sini salah satu yang paling enak di bandung , rasanya klasik , menu yang saya rekomendasikan di sini adalah sirloin dan tenderloin steak , jangan lupa pula coba beef shashlik nya yang tak kalah enak .	positive
saya dan keluarga seringkali wisata kuliner . salah satu tempat fav saya adalah 90 gourmet bandung . makanan nya sangat bervariasi mulai dari masakan jepang , makanan barat , korea juga kue-kue pastry plus ada pizza yang krispy setelah . semuanya bisa bikin perut kita kenyang terpuaskan . soal harga seh ya hampir sama saja dengan restoran lainnya . tapi soal rasa dan kualitas tidak pernah mengecewakan malah suka bikin kangen .	positive
rasa makanan : enak banget lokasi : jauh dari pusat kota 45 menit harga : 70 % lebih mahal dari rata-rata kafe pemandangan : oke banget : ada tempat main anak , parkir luas - : tua di jalan	positive
toko oleh-oleh yang satu ini menggabungkan konsep nya dengan kedai , yang sangat enak , mulai dari interior ruangan nya yang sangat nyaman , lalu snacks oleh-oleh yang enak serta terjangkau .	positive
mkom mending	positive
berada di dalam kompleks gedung putih cihideung parongpong , menawarkan objek wisata kuliner nuansa sunda banget dengan alam sejuk pegunungan dan bentuk bangunan dari bambu alam yang asri dan kampung	positive
setiap kali ke sini , saya selalu memesan macca honey toast , roti nya yang lembut dan es krim nya yang lumar di mulut hmm yummy , jika tidak suka dengan es krim green tea , bisa diganti dengan berbagai macam es krim , selain itu pilihan nya juga sangat banyak	positive
sarapan pagi yang menyenangkan di daerah utara bandung sambil menunggu pelayanan kendaraan yang kebetulan tempat nya berseberangan . menu sarapan pagi buy 1 set 1 ini sangat menarik karena selain cukup lezat juga menjadi sangat ekonomis untuk sarapan kami sekeluarga . nasi goreng lezat dan omelet adalah menu yang kami pesan di samping kopi machiato dan green tea serta wafel dan ice cream .	positive
mi aceh goreng udang es teh tarik , enak banget . sejauh ini cie rasa loom adalah warung mi aceh terenak di kota bandung .	positive
sudah siap , ini , buat milih bima arya di pilkada nanti , terpercaya dan bukan cuma janji , hasil kerja nya juga pasti .	positive
kalau lapar tengah malam ke sini saja masih buka kok , tempat parkir nya juga luas yang tersedia .	positive
ayam nya enak manis empuk , selalu jadi pilihan lauk untuk akhir pekan 1 ekor nya sekarang 50 ribu lumayan juga harga nya sesuai sama rasanya	positive
mantap pak presiden terima kasih atas kontribusi bapak terhadap nkri semoga bapak senantiasa diberi kekuatan , kesehatan , kesabaran , dan panjang umur dalam menghadapi dinamika yang terjadi di masyarakat , hiruk pikuk politikus , dan koruptor yang masih merajalela di negara ini .	positive
sore hari desember musim hujan di bandung , kopi sore hari di pawon pitoe terasa nikmat suasana dingin . lanjut makan malam dihibur dengan lift musik serta berbagai pilihan menu . suasana sangat nyaman .	positive
selain makanan nya yang enak , tempat nya sangat unik dan kereen banget . udara nya segar dan sangat rindang	positive
lokasi tepat di sebelah parkview hotel di seberang sukajadi hotel . rasa pas di lidah , dessert nya tak terlalu manis terasa pas di lidah , tidak membuat enek , malah membuat ketagihan . untuk menu utama seperti udon , rasanya gurih namun tak terlalu asin , enak banget . harga acceptable , sesuai kantong . pelayanan ramah , cocok untuk tpt nongkrong malam minggu .	positive
cendana bistro , kafe yang berada di jalan sukajadi ini masih satu management dengan zen reflexiology . akan tercium wangi yang sama dengan aromateraphy yang ada di zen reflexiology . kafe nya sangat modern dan homey . ada mini garden di kafe ini . makanan nya pun cukup enak dan harga nya terjangkau .	positive
saya pelanggan setia mi ini . terutama di cabang - nya yang di paskal hypersquare . mi - nya memang sangat enak . makanan andalan saya selain mi adalah pangsit goreng .	positive
tempat nya di samping selatan stasiun bandung . sate nya enak , empuk dan bakar nya pas . tidak salah deh milih makan sate di sini . mau pilih sate hati juga ada . kalau ke bandung maulah mampir ke sini lagi	positive
makanan nya enak sekali , porsi nya tidak terlalu banyak , tapi harga nya lumayan mahal . tempat nya sudah agak tua kecuali gerai-gerai di makanan court .	positive
saya beberapa kali berkunjung ke dusun bambu dan sudah menikmati makan ala foodcourt dan makan di resto nya . kalau di foodcourt , harus menukar uang dengan koin , makanan di food court kebanyakan makanan sunda , cemilan , kue-kue atau aneka mi , ada juga kue serabi . kalau makan di resto nya burangrang , makanan bervariasi , makanan barat , asian , indonesia dengan tampilan menarik .	positive
tempat nya sederhana , tapi makanan nya enak . bisa panggang sendiri daging yang kita pesan . tapi minta dipanggangkan juga bisa . daging nya ada daging kambing , ayam , cumi , dan lain-lain . jual banyak minuman dan jus juga .	positive
lokasi bagus banyak spot untuk foto baik di danau buatan maupun di antara kebun bunga , namun untuk permainan harga tergolong mahal , makanan tidak terlalu istimewa . hindari hari libur karena tidak akan nyaman , terlalu ramai .	positive
tempat ini cukup jauh dari pusat kota lembang , namun sangat disarankan bagi keluarga dengan anak kecil . disediakan tempat bermain untuk anak-anak dengan membayar 50.000 rupiah , bisa bermain sepuas nya . banyak pilihan menu makanan juga	positive
rumah makan nya sih unik . luas juga . parkir nya juga gede . masakan nya campur-campur sih . ada jawa , chines makanan dan makanan barat juga . harus coba deh kalau ke bandung . homie dan yummy .	positive
lokasi nya berada di pvj tepat nya di dekat fitness celebrity . seperti calais pada umum nya , tempat nya bersih dengan desain alan - ala kafe . favorit saya di sini adalah bule yang meletus-letus .	positive
sekilas mengenai sop durian lodaya : tempat makan durian waralaba yang cabang nya sudah ada di-mana hal yang saya sukai : - pelayanan oke , mbak waitress mencatat pesanan dengan tepat dan menggunakan teknologi terkini yaitu tablet sepertinya bisa menghemat waktu catat - menu mabuk durian benar-benar bikin mabuk dalam arti positif dan rasa duren nya satu sama lain bisa dibuat konsisten .	positive
udara yang sejuk disertai kerlip lampu menerangi gelap nya dimalam hari . terbaik makanan dan enak . saya suka ini romantis tempat	positive
saya ke kafe dipakar bersama keluarga , pemandangan nya memang keren banget . makanan nya juga enak-enak . untuk bersantai menikmati sajian dan pemandangan di dipakar sangat menyenangkan . kami ke sana hari minggu , dan sangat ramai pengunjung . tapi tidak menunggu lama , kami langsung dapat meja . untuk makanan , setelah kita order tidak perlu menunggu lama , makanan sudah datang . untuk foto-foto juga sangat bagus .	positive
enak . setiap ke bandung menu wajib buat saya sekeluarga . pedas nya mengigit .	positive
bakmi favorit makan bersama pasangan . menu favorit kami : - bakmi spesial : jamur nya enak - pangsit goreng isi 5 : gurih - tea manis : rasa manis gula nya unik secara keseluruhan baik : menu nya enak dan unik . tempat nya luas dan bersih pakai tcash diskon 20 %, lumayan hemat :	positive
secara umum tempat ini sangat membuat betah untuk duduk bersama teman teman . variasi menu yang banyak , dan kualitas penyajian yang baik di tunjukkan oleh restoran ini . interior nya akan membuat betah untuk foto-foto , namun di sisi lain dalam aspek harga dibanding kafe / restoran sejenis secara harga cukup di atas rata-rata .	positive
bubur ayam di bandung memang banyak tetapi bubur pak hamid lumayan terkenal sejak dulu , untuk rasa silakan coba sendiri , karena lidah orang itu beda beda penilaian nya , tetapi meurut saya lumayan enak .	positive
restoran dengan metode penyajian berbeda . piring tempat makan diganti dengan lembaran daun pisang . menu makanan khas sunda dengan citarasa yang enak . dari segi harga cukup bersahabat , tempat makan luas dan banyak pilihan meja , parkir cukup luas .	positive
bang fadli dan fahri hamzah mumpuni dan top banget	positive
mohon ulama lurus dan k212 mmbri hujjah partai apa yang harus diwlh agar suara islam tidak pecah-pecah	neutral
setiap bumn dibentuk dengan uu bukan dibentuk dengan uu .	neutral
pdip sebut ridwan kamil menang karena berbaju merah	neutral
08:30 : kedatangan presiden ri dan rombongan di gate 2 , terminal 3 disambut oleh menteri perhubungan , menteri bumn , gubernur banten , dirjen perkeretaapian kemhub , dirut ap2 , dirut pt kami , dan dirut railink	neutral
risma menjatuhkan pilihan nya pada gus ipul - puti di pilgub jatim 2018 ini .	neutral
hai tolong bantu saya tidak bisa input tidak resi jne dan kenomor resi sudah dipakai .	neutral
mardani ali sera : kemenangan di sosial media , akan selalu kemenangan di dunia nyata .	neutral
singapura selidiki penjualan prt indonesia di situs daring	neutral
suasana di kantor dpc kab. bogor menjelang pidato awal tahun 2018 oleh	neutral
hasil quick count pilgub kaltim 2018 , isran - hadi unggul	neutral
nanda mulai bekerja di dhl indonesia bulan depan	neutral
kubu djarot klaim unggul di real count sementara	neutral
kericuhan yang terjadi pengujung debat kedua pilgub jabar pada 14 mei 2018 yang lalu , menimbulkan silang pendapat dari para kontestan debat .	neutral
menurut sby , yang dipilih dari pilkada adalah sosok bukan partai politik .	neutral
angka satu dianggap menjadi pembawa hoki di pilkada jawa .	neutral
temui anies - sandi , sudirman said bahas finalisasi tim gubernur - mantan ketua tim sinkronisasi anies - sandi , sudirman said menyambangi balai kota , untuk membahas finalisasi tim gubernur anies baswedan	neutral
minimal mohon bantuan nya order saya belum diambil berng nya oleh driver gojek tetapi status nya sudah dalam proses pengantaran	neutral
prediksi persija jakarta vs psis semarang 18 september 2018	neutral
kebakaran hutan di sumbing meluas	neutral
saya sudah registrasi tapi tidak dapat sms dari 5111 .	neutral
ketua dpr ingin agresivitas berutang harus dikontrol	neutral
memasang foto editan rizieq pakai topi santa claus , ade armando dipolisikan	neutral
saya menjadi seorang editor di national geographic indonesia	neutral
tenggak miras oplosan , dua pelajar di tasikmalaya tewas	neutral
periksa setya novanto , kpk telusuri keterlibatan pihak lain di korupsi e-ktp	neutral
dia biasanya membeli tisu paseo	neutral
tweeps , bila kamu selesai transaksi mengirim , pastikan cek kembali alamat di resi sebelum meninggalkan counter jne pondok timur ya	neutral
info refundable atau tidak sudah terdapat di pesan summary dan saat pengisian data penumpang ya .	neutral
merefleksikan penyelenggaraan pelayan publik di kepris	neutral
biar besok jadi anggota dpr	neutral
tokoh-tokoh penggerak gerakan partai pki indonesia : sby , iwan skeneder , paul dundes woolvowiz , oliver north , calvin haris , agung sasongko , putra mas agung , agung priyambodo , eko pratomo curup jehan , dan si : kopral pki tri sutrisno c.s. .	neutral
gus mus bela dan doakan menteri susi pudjiastuti via	neutral
sudah di revisi om dengan	neutral
berita indonesia : perdagangan bei ditutup , presiden bangga ihsg tembus 6.355	neutral
ibu rohmah minimal transaksi transfer ke sesama rek mandiri atau pun ke rek bank lain minimal rp 1 , - . terima kasih nida	neutral
telah hilang handphone xiaomi redmi note 5 warna gold 64 / 4 di daerah duri selatan , jembatan lima , tambora , jakarta barat .	neutral
montenegro - kroasia masih beda pendapat soal kapal latih jadian	neutral
ridwan kamil sesalkan disebut klaim desain masjid terapung gedebage	neutral
ajak keluarga , kawan satu kantor , kawan jalan , pacar , kawan pacar , atau bahkan mantan pacar , buat suara award ini .	neutral
selamat siang , jika ada hal lain yang bapak akan tanyakan dapat mention kami kembali . terima kasih zan	neutral
usung dedi mulyadii , golkar rayu pdip , demokrat dan ppp	neutral
nyai pesantren di gresik deklarasi dukung gus ipul	neutral
menteri retno dan susi joget diiringi lagu country	neutral
bogor akan dipimpin kembali oleh bima arya .	neutral
tolong dicarikan driver baru triliun - gr12290397000	neutral
pkb pertimbangkan tinggalkan ridwan kamil jika usulan nya tidak diakomodir	neutral
lima tahun ke depan , not fokus produksi - produktivitas pertanian	neutral
di sela-sela pertemuan wef on asean , presiden jokowi hadiri peluncuran go - viet	neutral
semoga selalu setia menemani rakyat indonesia dari sabang - merauke , dari kota sampai pelosok desa .	neutral
pajak , kak , mau minta nomor efin , sebelumnya sudah aktifasi , tapi lupa password akun djponline ,	neutral
yang terhormat tolong dong respon pesan langsung saya . terima kasih	neutral
harapan kami anda sebagai pemimpin negeri ini . kekayaan yang kita miliki . akan kembali kepada rakyat , rakyat hidup makmur , nkri harga mati . kita rebut kembali kekayaan negeri ini yang telah jadi bancakan para penghianat dan penjual aset bangsa . bravo bung prabowo . insyaallah	neutral
jokowi mau manathir memproses kasus aisyah secara hukum .	neutral
yuk ikutan	neutral
mewujudkan standar pengelolaan pendidikan berstandar nasional .	neutral
teguran sri mulyani ke anies baswedan soal besar nya biaya perdinas jakarta	neutral
jauhi narkoba adalah salah satu cara yang bisa digunakan untuk meningkatkan kualitas anak bangsa .	neutral
kalahkan karolin di quick count , kata sutarmidji : sudah kelihatan	neutral
llorente dan alli menangkan spurs atas swansea	neutral
trump perintahkan tarif pajak tambahan pada barang-barang china dilanjutkan	neutral
dedi - deddy , duet penyabar bakal bikin jawa barat berkibar	neutral
sudah . tapi tetap belum masuk	neutral
lumayanlah kalau pengen nyobain makan dengan sensasi yang berbeda pakai alas daun begitu , rasanya ya begitu saja , kita pesan terus goreng , tapi bagus nya di sini itu dikasih kuah gratis , kuah rendang di restoran sunda wow sekali	neutral
bni syariah sediakan layanan e collection untuk mahkamah agung	neutral
jual 268 rak dinding aluminium serbaguna 2susun 31,5 x 14 x 16 cm - magic Jakarta	neutral
anthony genting ditunggu wakil denmark di perempat final	neutral
saya tidak bisa akses atau lihat transaksi yang masuk di akun tokopedia saya , tapi kalau dari akun lain yang terkoneksi , bisa .	neutral
dapatkan voucher pulsa rp 25.000 , - untuk dua orang yang beruntung setiap hari nya hanya dengan retweet bniquotes	neutral
kpk siap kawal pembahasan rapbd malut	neutral
minimal driver ini tidak mau pickup barang dari tadi siang . mohon ditindaklanjuti .	neutral
achmad - nurzahedi maju pilgubri 2018 diusung demokrat dan gerindra	neutral
bukan pelaporan 13591191 , bukan tiket aduan 13591905 , mohon segera di selesaikan	neutral
id : saat nya membuat karya visual 360 derajat dengan samsung ! ikuti langkah mudah di video ini .	neutral
oke , terima kasih atas tanggapan nya	neutral
kata nya indomie goreng ngeluarin rasa baru	neutral
mau juga kan , jangan lupa ikutan dan mengikuti ya teman-teman .	neutral
kalau ada pulsa segudang , akan mengaktifkan wi - fi buat semua orang biar bisa internetan	neutral
persoalan pajak alat berat di kalsel temui titik terang	neutral
ya sudah biarkan anis sandi saja memimpin 2 periode .	neutral
60 ledakan sebabkan puluhan rumah terbakar di as	neutral
terdakwa mantan ketua dpr ri setya novanto mendengarkan pembacaan tanggapan atas eksepsi oleh tim jaksa dalam kasus ktp elektronik .	neutral
untuk layanan weekend banking yang berlokasi di bekasi , bapak ernest dapat datang ke kantor cab bank mandiri bekasi juanda .	neutral
merasa ada diskriminalisasi pada 3 daerah pilkada , begini curhatan nya	neutral
usut kasus blbi , kpk periksa menteri era megawati	neutral
kalau kucing gua kasih makan sabun dana kira-kira mati tidak ya .	neutral
kami kemari siang hari waktu makan siang di hari minggu bersama dengan teman kelompok kecil bir - delapan orang . di lantai atas kami harus menunggu kursi orang yang sedang makan karena semua kursi penuh . akhirnya kami dapat 1 meja untuk ukuran 4 orang yang akhirnya di tempat per-enam .	neutral
jika nantinya terdapat kendala lainnya dan ingin menanyakan seputar tokopedia , jangan sungkan menghubungi kami kembali .	neutral
dalam ajang piala dunia 2018 nanti , telkomsel mengambil bagian sebagai licensed mobile broadcaster dalam perhelatan sepak bola	neutral
docmart itu merek , singkatan dari dari . martens .	neutral
