warung ini dimiliki oleh pengusaha pabrik tahu yang sudah puluhan tahun terkenal membuat tahu putih di bandung . tahu berkualitas , dipadu keahlian memasak , dipadu kretivitas , jadilah warung yang menyajikan menu utama berbahan tahu , ditambah menu umum lain seperti ayam . semuanya selera indonesia . harga cukup terjangkau . jangan lewatkan tahu bletoka nya , tidak kalah dengan yang asli dari tegal !	positive
lokasi strategis di jalan sumatera bandung . tempat nya nyaman terutama sofa di lantai 2 . paella nya enak , sangat pas dimakan dengan minum bir dingin . appetiser nya juga enak-enak .	positive
betapa bahagia nya diri ini saat unboxing paket dan barang nya bagus ! menetapkan beli lagi !	positive
makanan beragam , harga makanan di food stall akan ditambahkan 10 % lagi di kasir , suasana ramai dan perlu perhatian untuk mendapatkan parkir dan tempat duduk .	positive
tempat unik , bagus buat foto , makanan enak , pegawai ramah , bersih dan luas , wifi kencang . harga standar dan sesuai dengan tempat nya . ada menu masakan makanan barat dan indonesia . menu favorit lychee mojito dan spagheti	positive
saya bersama keluarga baru saja menikmati pengalaman kuliner yang menyenangkan di rm sari sunda di jalan . setiabudhi , bandung . tapi , karena tidak ada hubungan untuk rm sari sunda di jalan . setiabudhi , maka saya tuliskan di sini . jadi , maaf jika rekan-rekan pembaca ada yang bingung . beberapa hal yang saya suka dari restoran ini adalah bahwa pelayanan restoran ini terbilang cepat .	positive
bersyukur	positive
sekadar menceritakan pengalaman saya pesan steak grilled beef 200 tidak disajikanlah steak 200 tidak tersebut dalam 2 potongan 100 tidak - 100 tidak rasanya tidak buruk , namun kualitas daging nya yang membuat saya enggan memesan menu beef lagi khusus nya sirloin karena lemak nya terlalu banyak untuk ukuran steak namun , masih ada menu-menu lain yang sangat menempel di lidah saya sarankan untuk membeli menu berlabel cheese atau . lanjutan	positive
sehabis puas bermain di trans studio bandung , saya bersama teman sepakat untuk makan ayam kakek di sini . ayam nya selalu enak dan gurih !	positive
rasa bakso cuanki dan batagor cukup . selalu ramai pengunjung . buka sekitar jam 10 pagi . dari jalan riau menuju jalan a yani ada sisi kiri jalan sekitar jalan anggrek . harga per porsi sekitar rp 14 000 . datanglah lebih awal karena selalu ramai pengunjung	positive
sgwr 2018 beri dampak positif terhadap hobi anak-anak	positive
berada di lembang , pemandangan indah , udara sejuk , penataan resto yang bagus , dilengkapi dengan makanan yang sangat nikmat . pilihan menu beragam dan minuman yang lengkap . lingkungan yang cocok untuk makan berdua dengan pasangan , membawa keluarga ataupun bersama dengan teman . lapangan parkir luas . restoran yang berkonsep terbuka ini membuat udara lembang sangat terasa sejuk nya .	positive
berbuka puasa di sini pada minggu lepas , pak supir yang mencadangkan tempat makan ini . makanan nya di sini sedap dan harga berpatutan . tempat nya luas dan cantik . rekomendasi too others to dine in here to rasa authentic sunda makanan indonesia .	positive
hahaha suka banget nonton kartun indonesia keluarga pak tomat	positive
bagi teman-teman yang sedang berkunjung ke bandung bisa mampir ke kopi anjis untuk makan makanan yang tidak terlalu berat . ada cilok rakyat ditemankan dengan teh sereh dan lekker .	positive
di restoran ini , saya dan keluarga makan malam yang terakhir di bandung . kami berjumlah 8 orang dan bila nya hanya sekitar 400 an , benar-benar murah meriah , sampai makan double-double lagi . makanan nya juga enak , suasana kafe menarik , pelayanan sangat bagus . saya masih teringat petunjuk toilet yang ada di restoran ini men to the pergi , karena momen are selalu ribut hahahaha . setimpal .	positive
lokasi dengan pemandangan alam yang masih natural dan indah . suasana juga sejuk dan tenang . hanya saja banyak nyamuk dan harga makanan relatif mahal .	positive
tempat steak di bandung sejak lama dari zaman setiabudi sampai sekarang buka cabang di riau . tempat di riau ini lebih besar , parkiran juga tidak sulit seperti di setiabudi . lokasi di tempat kuliner jalan riau . porsi dan harga nya pas untuk ukuran steak . untuk zoom non smoking nya nyaman .	positive
makanan tradisional yang selalu rasanya stabil iga garang asam nya dan java steak nya jangan lupa ya dicoba hidangan penutup semua kue enak lemper soes fla gulung . enak sekali tidak ada yang tidak enak kalau makanan di sini .	positive
sampai saat ini saya rasa batagor ini masih yang terenak di kota bandung dibandingkan dengan batagor lainnya yang saya pernah coba . bumbu kacang nya pas rasanya di lidah , dan batagor nya juga tidak amis bau nya . silakan mencoba untuk yang belum pernah coba .	positive
aroma khas yang ada jika makan di atas daun pisang , ya walau ramai tempat ini selalu jadi favourit saya jika ke bandung .	positive
akhir tahun lalu saya dan keluarga berjalan ke daerah lembang dan tidak sengaja mampir makan di resto ini . suasana nya nyaman , pelayanan juga ramah dan berlebihan ala kami puas . makanan yang di sajikan standar seperti makanan di restoran pada umum nya , tetapi yang membuat berbeda adalah sambal stroberi yang yummy dan bikin ketagihan . di sana selain bisa makan kita juga bisa sambil memetik . lanjutan	positive
pengalaman yang cukup seru , makan tanpa alas piring , tapi hanya dengan alas daun , makin nikmat . makanan sunda yang sangat bervariatif dan cukup enak . tips nya : jangan terbawa emosi dan kalap memesan dan memilih semua makanan yang disediakan biasanya kalap kalau sudah melihat makanan macam-macam begitu . pilih seperlunya .	positive
makanan nya enak , suasana nyaman . harga bisa dibilang sama dengan tempat lain . restoran ini ada 4 konsep tapi yang paling terkenal menu jepang nya yang enak loh	positive
kampung daun adalah tempat makan yang menyatukan konsep alam dan budaya dari daerah setempat . walaupun di dalam kompleks perumahan akan tetapi tempat tersebut cukup luas mempunyai mungkin sekitar 20 lebih saung / tempat makan dari yang kapasitas sedang hingga besar . kualitas makanan enak dan dengan ada nya suara riak air dari air terjun kecil di sana membuat suasana sangat nyaman untuk makan .	positive
waktu itu ke sini pesan nasi goreng dan kentang goreng , nasi goreng nya semua suka . kentang goreng nya enak banget , dan presentasi nya bagus . keluarga bilang kopi nya enak . hal yang sangat baik di sini adalah tempat nya luas dan yang di luar bisa lihat pemandangan dusun bambu , tapi pelayanan nya tidak cepat sehingga saya harus bertanya beberapa kali tentang pesanan saya . harga nya cukup mahal , namun karena makanan nya enak semua jadi terbayarkan . tidak perlu pikir dua kali jika mau ke tempat ini lagi .	positive
banyak sekali tempat makan sunda yang bertebaran di kota bandung , tetapi tidak tahu kenapa saya sangat jatuh hati dengan sebuah warung makan ini . ibu imas yang berada di dekat alun-alun kota bandung menyuguhkan rumah makan sunda dengan karakter warung nasi zaman dahulu yang di mana kita bisa mengambil semua hidangan di depan kita tanpa harus melalui proses order yang biasa kita jumpai di warung makan .	positive
foods : menu baru cheeseburger nya oke banget dan chicken wings pizza hut memang selalu juara . dirilis : mixing green tea yakult , perfect ! satu-satunya kekurangan pizza hut adalah pinggiran nya ,	positive
dusun bambu ini tergolong baru di bandung . tempat nya yang dekat banget sama almamater saya . membuat saya gampang cari ini tempat . pemandangan nya bagus . banyak tempat makan yang enak-enak . beli nya nanti pakai voucher .	positive
sesuai dengan nama nya mi awie , kedai makan ini menyediakan menu mi dengan olahan daging babi . selain mi masih ada pilihan lainnya seperti nasi goreng babi , capjay goreng , bakso , pangsit dan lainnya . kami mencoba menu mi babi casau special , rasanya . enak banget !	positive
terakhir ke tempat ini beberapa tahun yang lalu ketika masih berupa kafe , sekaramg sudah jadi penginapan dan boutique hotel . untuk yang travel bareng anak-anak pasti suka menginap di sini . ada playground yang seru , swimming pool , high rope , flying fox kalau menginap dapat tiket gratis dan petik stroberi perlu pesan - karena suka ramai . menginap di sini banyak pilihan kamar . enak .	positive
. pokok nya kurang kurang afdol kalau ke lembang atau ke bandung tidak mampir ke sini . 4 humas naik buat kampung daun .	positive
kfc bandung supermall fasilitas nya lengkap luas , agak jarang ditemukan dikfc lainnya . keramahtamaan karyawan nya juga sangat bagus	positive
restoran sapu lidi memilik keunikan tersendiri , serasa makan di tengah sawah , dikelilingin kolam ikan dan juga nuansa persawahan . menu nya seperti makanan sunda lainnya , tapi ada satu menu favorit saya , jamur bakar , enak banget .	positive
semua enak . mi abu-abu , mi black , tahu cocol dan sayap ayam nya mantap . buat makan camilan bisa di sini .	positive
pergi merayakan ulang tahun di tempat ini sangat berkesan , saya dengan istri memilih tempat ini , menu makanan variatif , dari makanan barat sampai lokal ada , sedia baju hangat . dingin sangat di sini .	positive
cepat respon . pengiriman kilat . dan ramah . setelah akhirnya saya berputar-putar di toko lain yang tidak jelas . saya bertemu toko juragan ini yang pelayanan nya sangat memuaskan . tangkap sangat juragan .	positive
ke sini beberapa tahun yang lalu bersama teman-teman . suasana nya sangat menyenangkan dengan pemandangan yang bagus dan hawa dingin yang menyegarkan . akan lebih baik datang ke sini pada malam hari . steak nya enak .	positive
dari saya debut . empat bagus tetapi yang bikin suka sekali itu tonight dengan saranghajima . tidak mengerti apa aku saja atau yang lain merasakan ini , winner adalah abang selain bigbang yang kalau nyanyi jiwa nya ikutan nyanyi . bagus banget . dan makin cinta dengan mereka setelah tahu sifat dan sikap saya .	positive
puas dengan servis nya , ramah ! harga nya sebanding dengan pelayanan dan rasanya . pemandangan nya yang keren banget , cocok buat acara ngumpul bareng teman dan keluarga ! pokok nya rekomendasi sekali ! tidak menyesal deh , pokok nya harus ke sini lagi ! saya dilayani oleh feriyana yang super ramah dan baik , pokok nya buat teman-teman the 18th ini recommened sekali !	positive
saya puas dengan games mobile legend	positive
saya bersama rekan kerja sengaja mencoba makan siang di sambal khas karmila cab . buah batu bandung , untuk tempat terbilang cozzy dan cukup nyaman jika di lantai atas , sedangkan lantai dasar saya rasa tidak lebih dari tempat makan makanan cepat saji yang cukup penuh dengan hiruk pikuk pelanggan . rasa ayam bakar di sini sangat saya rekomendasikan bersama sambal mangga . terkait harga terbilang relative .	positive
kuah bakso nya terlalu asin menurut saya . masih enakan yang dijual keliling di malang . tapi tempat nya bagus buat menjamu teman . ada di banyak lokasi dan selalu ramai . selain bakso juga menyediakan capcay , nasi goreng dan lain-lain yang menurut saya justru lebih enak .	positive
tenderloin steak nya juara , tempat mudah diakses memaki pun tersembunyi , nyaman , tema zaman dahulu , tidak ramai , pelayanan biasa ,	positive
ini adalah salah satu restoran chinese yang sudah ada sejak lama . masakan dari kepiting nya favorit juara . biasa saya pesan kepiting rebus , babat toge dan cah kangkung	positive
menarik pilkada jawa barat ini . ada ridwan kamil berpasangan dengan tokoh dari dc universe .	positive
lokasi pandan wangi sebenarnya agak jauh dari pusat kota bandung . tapi masih terjangkau , sekitar 15 menit dari jalan asia afrika . patokan jalan nya ada di jalan talaga bodas . dari sana tinggal mencari papan petunjuk pandan wangi . saat kami datang jam 1 siang sudah menanti begitu banyak orang . kebanyakan yang datang keluarga dan anak-anak . sambil menunggu disajikan gorengan dari ubi / singkong yang lumayan enak .	positive
pertama kalinya datang ke eatalia , saya datang bersama dengan teman dan 1 orang anak . tidak memsungkan ketika memlilih makanan untuk anak karena di sini menyediakan menu dengan porsi anak . kami memesan cheese bacon deluxe , pizza dengan roti berwarna hitam . untuk keseluruhan menu yang saya pesan tidak mengecewakan .	positive
rasanya lumayan . sambel nya juga enak . apalagi disajikan 3 macam model begitu . terus banyak pilihan sih sebenarnya mau makan apa di sini . mau gurame , mau kakap , bawal , kerang , cumi , udang . macem-macem deh . asal jangan pesan ikan kembung saja . tidak ada di sini .	positive
berlokasi di salah satu tempat belanja dan rekreasi di cihampelas wali bandung , resto ini tidak mengecewakan . sajian nya cukup beragam . untuk rasanya , resto ini bisa menyajikan nya dengan cukup enak dan nikmat , sangat cocok untuk bersantap dengan pasangan atau keluarga .	positive
restoran ini juga terletak di tempat stategis yaitu jalan dago . tepat nya di sebelah hotel holiday inn . sesuai judul nya , restoran ini menyediakan berbagai menu masakan aceh . favorit saya adalah mi aceh . harga standar tapi tidak terlalu mahal . jangan lupa coba roti canai nya	positive
bihun goreng nya enak . bisa minta tidak banyak minyak . makanan di sini mengandung babi jadi tidak halal . es teh tawar porsi nya besar dan memuaskan .	positive
sate kambing dan gulai kambing nya maknyus , penyajian makannan nya juga sangat cepat . tempat nya cukup bersih	positive
poach salmon nya enak , pelayanan nya enak , scenery nya mantap . tank to amanda dan worth it banget deh . pasti kembali lagi	positive
makan di restoran pizza ini paling enak jika bersama teman . menikmati paket sensasi delight yang harga nya sangat terjangkau oleh semua kalangan .	positive
paket gim benar-benar mantap ! yang megah harus makan di sini , dijamin makin keren ! bravo !	positive
di dekat gubernuran , tidak jauh dari jembatan penyebrangan , ada gang yang di dalam nya terdapat makanan yang sudah ada sejak zaman ibu saya . rasa kuah lontong kari kental dan agak manis , cocok ditambahkan acar yang ada di meja . porsi nya mengenyangkan	positive
berada di tengah tengah jalan braga , tempat nya lumayan enak untuk nongkrong , ada live musik , makanan nya pun lumayan .	positive
tempat makan pasta yang sudah tidak asing lagi apa lagi kalau bukan pizza hut . posisi pizza di tempat ini sangat nyaman inside mal atau outside mal berhadapan langsung dengan jalan merdeka anda bisa memanjakan mata sekadar melihat rutinitas orang-orang di sekeliling , letak sangat strategis dapat di lalu dengan angkutan umum .	positive
tempat makan ini nengusung konsep kembali to alam , kita makan di saung . dan sepanjang jalan menuju saung kita akan disuguhi pemandangan indah . suasana makan cukup nyaman , pelayanan cepat . rasanya enggan pulang , harga relatif standart tidak mahal untuk sekelas itu . rasa makanan sebenarnya standart saja , yang pasti suasana yang mantap .	positive
memberi cabai nya tidak pelit , masak nya cepat banget , rasanya enak , cuma kurang sayuran saja . tapi enak	positive
jangan pernah kecewa dengan apa yang diberikan oleh tuhan	positive
masakan jepang ada yang saya suka dan ada yang tidak , tapi dengan menu masakan yang satu ini karubi pas di lidah saya dan keluarga . dan tempat ini juga menyediakan tempat bermain untuk anak-anak harga makan di resto ini agak tinggi sih . tapi enak sekali masakan nya .	positive
tempat nya sih biasa saja , tidak ada yang istimewa . bahkan menurut saya , tempat nya ini menjadi sedikit nilai minus untuk penilaian kali ini . parkir yang tidak terlalu luas serta dekorasi ruang makan yang biasa saja . tapi lain lagi kalau kita bicara soal makanan . karena untuk urusan ini , red. dipo punya banyak nilai plus . makanan nya bervariasi dengan rasa yang di atas rata-rata .	positive
makan kaki kambing paha yang empuk dan lumayam besar untuk ukuran medium , pas untuk satu orang , makan tanpa nasi , dengan es lemon tea . segar kekurangan nya hanya tempat nya berasap , wajar kan namanyanjg kambing bakar hehehe	positive
bukti bahwa sunda memang gudang mode dan makanan . tidak dapat dijelaskan bagaimana enak nya bakmi parahiyangan . pokok nya pasti ketagihan	positive
sebenarnya barang kw juga banyak yang bagus kualitas . seringkali nih ya ternyata pas kita lihat eh ternyata barang nya memang bagus bahan nya	positive
saat makan di sini kebetulan saat libur panjang kemerdekaan 17 agustus . diperlukan waktu 40 menit lebih untuk antre . sistem pesan terlebih dahulu saat reservasi tidak diijinkan , padahal dapat menghemat waktu . tempat solat berada di depan pintu masuk dan permainan seni yang dimainkan sangat berdekatan dengan musola sehingga sangat menganggu ibadah . satu hal yang paling menakjubkan adalah suasana alam yang menyatu .	positive
cha-cha itu makanan ringan terenak dan tepat buat menemani waktu tugas	positive
tempat yang cocok untuk relax dengan keluarga , pelayanan nya bagus , makanan enak dan yang pemandangan / pemandangan nya mantap .	positive
paling enak di sini tuna mayo pizza nya yang pinggir nya pakai cheesy bites . harga cukup murah . pelayanan cukup baik . tempat strategis .	positive
bagaimana tidak romantis , udara dingin , suasana yang tenang dengan makanan yang lezat sambil menikmati keindahan kota bandung . sangat romantis sekali	positive
saya datang dengan pasangan untuk liburan . tempat ini sangat asri , sejuk . pemandangan sangat menarik . makanan tidak terlalu mahal tetapi menggugah selera .	positive
rasa enak banget ! wajib dicoba buat pecinta ayam bakar . harga pun sepadan . lebih enak kalau makan bareng-bareng sama keluarga tercinta , tempat makan nya enak .	positive
alhamdulillah , warga perbatasan bisa merasakan buah dari pembangunan . kita yang sudah lama menikmati mereka menunggu 72 tahun setelah merdeka dan sekarang 73 tahun merasakan nya . terima kasih pak jokowi , dari awal saya memang tidak pernah benci pak jokowi , justru saya salut sama beliau .	positive
berlokasi di daerah ciumbuleuit , agak terpencil . tapi kafe ini sudah cukup lama ada , tadinya hanya berupa halaman rumah yang di sulap menjadi tempat makan terbuka di taman . sederhana dan sunyi , buat mereka yang ingin nongkrong di cafe tanpa keributan / hiruk pikuk dan terlalu banyak orang , di sini tempat nya . makanan cukup oke dan bisa bersama lama .	positive
kampung bareto terletak di dataran tinggi bandung utara . menyajikan makanan indonesia dan makanan barat dengan saung lesehan dan meja makan . bisa juga digunakan untuk pertemuan keluarga , arisan dan makan bersama teman dalam jumlah banyak . cocok untuk menjamu tamu dan bersantai . setiap malam minggu disajikan musik live . tersedia juga kolam ikan untuk memancing . harga makanan di bawah 100k id. suasana nya tenang dengan pelayan yang sangat baik .	positive
senang sekali bisa berkunjung di ayam penyet bu tris , banyak menu yang tersedia , tapi pada saat itu saya hanya mencoba makanan sate , sungguh nikmat dan romantis sekali makan sambil ditemani dengan alunan live musik .	positive
pertama kali saya makan di sini secara tidak sengaja karena melihat antrean orang di depan restauran . rasanya enak , porsi mengenyangkan , harga terjangkau . kalau tidak terlalu lapar , sebaiknya pesan 1 / 2 porsi saja .	positive
nasi goreng hijau tren botti nya enak . yang lain oke-oke saja . jus lumayan seger . tempat nya lumayan buat ngumpul-ngumpul sama keluarga .	positive
kalau menurut kami ini merupakan restoran rekomendasi di bandung dari awal datang pelayanan nya bagus bagus pelayanan selain itu pemandangan di sini juga kece banget , makanan nya juga enak . tidak menyesal deh datang ke sini	positive
keren sekali tempat nya , benar benar sesuai dengan nama nya the 18th restoran dan lounge . nyaman sekali tempat nya . cocok banget buat makan sama keluarga . rata rata yang ke sini sama pasangan nya sih . tapi sama kelurga juga lebih asik kok . pelayan nya baik banget , ramah pula . untuk harga makan nya juga standar kok	positive
makan siang yang memuaskan . menu dengan buffet system , rasa enak dengan penyajian yang uni juga cara menikmati nya dengan makan langsung beralaskan daun pisang . sensasional . mencoba menu tutut yang dimasak kuning dan jengkol crispy , it s incredible but quite yummy . rekomendasi .	positive
mantap sekali , ambo kue lembut dan legit , kuah yang banyak , lokasi dan tempat terbatas . di sini jual juga makanan lain seperti nasi tim ayam yang enak	positive
seorang teman mengajak hang out saat sore , sayang nya tempat parkir hanya muat tidak lebih dari 5 mobil . jadi susah dan lumayan menghabiskan waktu yang lama hanya untuk mencari tempat parkir .	positive
makanan nya enak dan variasi makanan lumayan banyak . buka sampai malam dan cocok untuk yang cari makanan di malam hari	positive
yamien manis nya mirip banget dengan mi nursijan yang asli yang sekarang sudah tidak ada lagi karena si angka nya sudah almarhum . nasi goreng nya juga rekomendasi	positive
semakin sedikit engkau berbicara tentang kualitas mu , semakin orang ikhlas menghargai kehebatan mu	positive
paketan nya murah dan setimpal banget , aku pakai unlimited 60k sinyal bagus , bisa streaming terus-terusan . meskipun sup nya turun tetapi tetap bisa internetan . tidak kuatir kuota habis , tidak perlu merek-merek kuota lagi . tidak menyesal beli ini .	positive
untuk warga bandung yang senang menikmati kuliner bandung , pasti nya tahu restoran satu ini . sejak saya kecil orang tua saya kerap membawa saya untuk menikmati sate yang satu ini . ukuran nya yang cukup besar serta bumbu kacang nya yang khas selalu memaksa saya untuk kembali lagi ke restoran ini . bagi anda yang belum pernah mencoba nya , saya sangat merekomendasikan restoran ini !	positive
tempat nyaman , retro . menu andalan nya adalah grill , tapi saya pesan nasi goreng sea food , dan rasanya enak	positive
tidak bakal salah kalau pesan jus stroberi , nasi liwet sama sop buntut nya . : cek out their butik villa ! cocok buat yang mau relaxing seharian di pinggir kolam dengan buku atau ipad . surga !	positive
kampung daun memiliki suasana yang nyaman , seperti di pegunungan , makan siang ataupun makan malam , di kampung daun ini sangatlah romantis , ditemani gemericik air , suasana hijau , cuaca sejuk , dengan makanan khas sunda indonesia selain itu sudah ada makanan luar seperti steak , yang ingin mencicipi menu istimewa seperti nasi timbel dan nasi campur sunda sangatlah cocok di sini . makan serabi ditemani minuman bajigur menambahkan hangat nya suasana .	positive
jokowi tidak suka sebar isu bohong	positive
cinta banget sama produk negeri yang keren , modis , berkualitas dan terjangkau	positive
menurut saya black-black keren , bisa dipakai buat olahraga dan aktifitas lainnya , mantap !	positive
terima kasih atas jasa nya , saya sangat puas , pelayanan nya sangat baik dan ramah , pendamping nya juga keren , menyenangkan .	positive
nongkrong cantik memang enak nya di sini . tempat nya luas , suasana nya oke . kemarin saya tidak coba kopi nya , kita pesan goulash soup , salmon steak chicken steak nya . goulash nya enak , steak nya not jadi sangat , saya rasa dengan harga yang agak mahal di situ masih dapat yang lebih enak di tempat lain . but secara keseluruhan baik okelah buat nongkrong sambil minum kopi atau meter ya	positive
warung roti ini terletak di daerah gardu jati . menyediakan aneka roti bakar baik porsi kecil maupun besar . pisang bakar serta bubur ayam juga melengkapi menu . bubur ayam kampung sangat gurih dan menggoda . patut dicoba !	positive
steak yang sudah puluhan tahun di bandung ini sudah sangat tersohor . dari zaman saya sampai setiap ke bandung dan kalau mau steak pasti meluncur ke sini . stand pertama nya banget yang saya tahu ya itu di jalan setiabudi . suis butcher steak house setiabudi jalan . setiabudi no. 174 bandung 40141 telepon . 022 - 2033172 fax . 022 - 2038829 steak ini enak banget .	positive
masih di sekitaran setiabudi , yang banyak sekali resto , kafe dll. nah kali ini kami mencoba ke tempat ini hitam romantiuc . untuk mencoba iga konro nya , dan masih banyak lagi menu yang lainnya seperti masakan westrn indonesia dan asia lainnya . harga nya murah dan pasti terjangkau sekali . apalagi untuk anak-anak muda .	positive
kalau ke bandung selalu mampir ke lomie karuhun . lokasi nya strategis di pinggir jalan pasir kaliki . rasanya enak . kuah nya kental . jangan lupa pakai sambal dan jeruk . harga nya tidak terlalu mahal . top .	positive
restoran ini mempunyai pemadnagan yang sangat indah namun penataaan meja makan sungguh berantakan menimbulkan kesan restoran biasa bukan setara kafe ataupun lounge untuk harga standar dan rasa pun standar	positive
ini merupakan salah satu mi legendaris di bandung dan temap nya tidak banyak mengalami perubahan sampai saat ini , dengan bangunan tua seperti rumah biasa . saya suka mi yamin asin , mie nya lembut dan sepertinya home membuat . kuah kaldu nya gurih .	positive
mengagumi	positive
tiap kali ke bandung tak lupa mampir ke tempat ini . steak nya enak , empuk , murah , dan rasanya original dengan lidah indonesia . cobalah tenderloin steak dan potato ala suis , dijamin ketagihan .	positive
saya ke sini bersama istri dan anak saya . ke sini juga gara-gara melihat ulasan di inet . tempat nya di jalan riau persis bersebelahan sama outlet cascade atau heritage . dekorasi nya dibuat homy .. tempat duduk yang luas dan jarak antar meja yang berjauhan sehingga nyaman untuk mengobrol dan ketawa-ketawa tanpa ada yang protes . memang di sini khas nya adalah coffee and cake .	positive
tempat lumayan romantis , kalau bawa pasangan . karena kebetulan pas saya ke sana , malam hari tapi gerimis , jadi pemandangan ke bawah , kurang oke . sayang banget , padahal sudah siap-siap bawa kamera . seragam pelayan sepertinya harus diganti deh , saya pikir security , ternyata pelayan : ronde nya enak . kita pesan satu makanan juga tapi sepertinya lupa diorder ke dapur .	positive
tidak usah bingung dan ragu . bergabung dengan adalah pilihan yang tepat ! akan ada banyak manfaat yang didapatkan .	positive
