ini adalah restoran favorit anak saya . menu kesukaan nya adalah kepiting saus singapore . rasanya pedas menggoda . anak saya yang lain suka cumi goreng mentega . meskipun berkuah saus , gorengan cumi nya kriuk . rasanya manis dan tidak pedas . alamat nya agak susah dicari , tapi worth the effort . sebetulnya sangat mudah dijangkau dari jalan riau . jika anda berkendara di jalan riau dari arah dago , tinggal belok .	positive
wagyu dan japanese prime - nya rekomendasi . tingkat kematangan pas sesuai dengan permintaan . secara keseluruhan , makanan enak dan harga sesuai dengan kualitas . namun tempat menurut saya masih kurang nyaman dan kurang besar . non-smoking area sempit sehingga lebih enak duduk di smoking area .	positive
sudah beberapa kali ke sini , tetapi tidak pernah bosan dengan suasana yang romantis , tenang , like pribadi resto . dari makanan endus , pelayanan oke punya . direkomendasikan to visit here	positive
tempat makan yang sangat nyaman dan sajian makanan dan minuman yang sangat selera sunda , dengan harga makanan dan minuman kelas menengah ke atas dan rasanya sangat enak semua dan porsi nya cukup banyak . makan di saung sangat nikmat karena diiringi musik sunda dan kucuran air .	positive
makaroni di sini enak sekali . pizza nya juga enak dan kulit nya tipis sekali . harga nya mahal dan porsi nya kecil cukup untuk wanita .	positive
kami selalu menyempatkan mampir kemari kalau bertandang ke bandung . dengan potongan daging yang besar , saos kacang yang kental , dan harga yang standar membuat kami sangat merekomendasikan sate di sini !	positive
nasi putih mungkin belum terlalu terkenal tapi masakan di tempat ini sangat layak untuk dicoba . suasana restoran menyenangkan , terkesan teduh dan tenang . makanan yang disajikan juga sangat menarik dan sangat indonesia .	positive
aurora coin beli di indodax bisa bikin untung besar	positive
semua makana nya serba babi dengan berbagai macam kombinasi dengan rasa yang enak , dengan minuman yang menyegarkan cocok until makan pagi siang dan malam dengan suasa ruangan ala kafe	positive
dalam sajian piring yang berbentuk kotak serta rapi , membuat menu yang terhidang menjadi lebih menarik . rasa juga enak memenuhi selera , dengan staf restoran yang sangat informatif . mencoba sayuran lotek dan karedok , ternyata selain segar , juga nikmat . bumbu yang disajikan sempurna . lezat sekali . selain itu restoran ini juga menyediakan berbagai masakan indonesia , cireng , pempek , dan dessert yang lezat .	positive
kepongahan telah membatalkan prediksi , kini akal sehat rakyat sudah tumbuh .	positive
kami sekeluarga mampir di restoran sea makanan d cost , khusus masakan sea makanan . sayang kepiting habis . hanya kepiting kecil yang makan dengan kulit . kurang enaklah . jadi pesan juga udang goreng oke okelah	positive
tempat nya cukup nyaman , lebih nyaman dari sebelumnya di ciwalk , tapi tidak sebaik dan senyaman tempat pertama kali buka di ciumbuluit . makanan nya enak , favorit : chicken steak dan beef cordon blue .	positive
menawarkan hidangan roti dimalam hari , boleh coba susu murni dan padanan roti keju atau stroberi . roti zaman dulu tapi rasa tetap enak dibanding roti-roti saat ini	positive
terletak di belakang rs . boromeus , daerah dago , sangat gampang dicari . kalau dari arah jalan layang masuk jalan dago , belok kanan pas sebelum rs boromeus kira-kira 400 meter kiri jalan . lumayan ramai , tapi pelayanan nya cukup cepat . kami pesan 2 roti bakar dan 2 kopi yang nikmat . porsi yang cukup besar buat kami .	positive
salah satu sudut kota bandung terdapat beer house bernama q meal di daerah ciumbuleuit . tempat yang saya nyaman dan ramah apalagi di sini terdapat bar yang langsung menghadap ke open kitchen mereka . salah satu pemilik / chef nya sangat humble dan senang berbagi cerita . bahan makanan yang disiapkan pun termasuk yang terbaik dikelas nya . salah satu alasan saya suka dengan tempat ini adalah flavour beer . mantap .	positive
menu nya beragam . waktu itu saya mencoba beli pizza nya yang besar . ukuran pizza nya panjang dan tipis , maka dari itu pizza nya saya bilang crunchy	positive
suka banget kalau ke bandung datang ke sini , banyak pilihan masakan dan sayur lalapan , khas sunda banget . tutut nya enak banget , es goyobot juga . mantap banget pokok nya	positive
ayam mcd jauh lebih enak	positive
tempat ini sedikit berbeda dengan yang ada di bandung saat ini . di tempat ini pengunjung bisa menikmati alam , restoran , kedai makan , area bermain anak serta penginapan . dengan lokasi nya di atas gunung , tempat ini sangat menyegarkan dan pada malam hari tempat ini cukup dingin . untuk menuju tempat ini pengunjung nanti akan dimenyediakan kendaraan wara-wiri dari parkiran sampai ke lobby .	positive
batagor atau bakso tahu goreng adalah makanan khas bandung . di kingsley , batagor yang dijual berbeda dan berkualitas premium . ukuran nya besar , menggunakan tahu yun yi putih yang lembut dan mantap , rasa ikan nya pun sangat terasa . batagor bisa dipesan matang maupun setengah matang tahan 3 hari di dalam kulkas , jika ditaruh di freezer bisa lebih lama .	positive
tempat ini memang pas banget untuk yang butuh kenyamanan dan privacy , karena di resto ini memang menyediakan beberapa room khusus , setiap kali ke dakken saya selalu reserve ruangan khusus karena biar bebas saja ngobrol dan ketawa-ketawa nya , jadi tidak akan ganggu orang sekitar nya , sudah begitu bisa bangga pada diri sendiri - bangga pada diri sendiri tanpa malu ada orang lain yang melihat , poko nya benar-benar ruangan milik kita deh , hehehe .	positive
makanan nya enak-enak dan semua worthy ! dari sajian pembuka nya sudah bikin ingin menambah ! ditambah main corse nya yang ukuran jumbo . tidak menyesal deh makan ke sini	positive
foodcourt di luar yang luas menyajikan segala makanan dari tradisional hingga yang termodern , dari harga yang murah meriah hingga yang mahal . penataan dekorasi yang apik akan membuat betah . sayang pada saat ke sini cuaca sedang hujan gerimis sehingga harus berjalan agak jauh untuk memilih tempat duduk	positive
kedai nyonya rumah di jalan naripan bandung , kafe cukup besar , dan makanan dan minuman nya sih okok saja , juga di depan toko tersedia kue-kue dan roti dan macam kue , di sebelah toko ada juga dunkin donat , bisa sekalian pesan dan nikmati di dalam .	positive
kemarin nyobain aglio olio tuna , mushroom soup , potato cheese , steak icip dikit , dan semuanya itu enak sih . bahkan aglio olio setelah dalam sekejap banget , padahal porsi nya lumayan banyak saking lahap nya . tempat nya juga nyaman . staf nya ramah dan tanggap . suka it !	positive
tempat nya sejuk , jauh dari keramaian kota . selain untuk makan , juga cocok untuk foto-foto dan rekreasi .	positive
kalau mau merasakan roti zaman dahulu , ini salah satu tempat nya . buka nya hanya sampai sore , jadi kalau pulang kantor kadang tidak keburu ke sini	positive
plus : makanan nya enak dan bervariasi , banyak menu es contoh nya : es goyobod cincau , jengkol nya enak tidak bau	positive
porsi nya agak besar buat ukuran saya . topeng nya lumayan enak , tapi rasio nya cenderung manis , jadi nabrak buat makanan gurih dan berminyak . jeroan babi rebus nya enak , porsi nya raksasa banget . setengah porsi bisa buat makan 4 orang . harga termasuk murah , buat yamien di bandung	positive
mencari tempat nongkrong 24 jam di bandung , mungkin mcd simpang dago ini menjadi salah satu favorit nya . siapa yang tidak kenal dengan merek mendunia ini , tentunya menu yang ditawarkan sudah dapat dibayangkan . lokasi sangat strategis serta area seating yang cukup banyak . suasana malam hari biasanya cukup nyaman untuk mengobrol-ngobrol bersama teman .	positive
sudah terhitung lebih dari sepuluh tahun saya selalu menikmati sioamay dan batagor setiap kali berkunjung ke bandung . dari harga masih dua ribu lima ratus sebuah nya . kingsley hanya menyediakan 3 macam menu yaitu mi , siomay dan batagor . untuk mie nya , rasa standarlah , cukup enak . favorit saya adalah mi yamin manis pangsit . camilan batagor dan siomay , saya lebih suka siomay nya karena rasa ikan nya kuat .	positive
suatu kebanggaan untuk saya bisa mengunjungi salah satu restoran yang sedang hits dan kini ramai diperbincangkan banyak orang dengan semua kemewahan tempat , presentasi makanan serta fantastic layanan nya . alhasil , ini kebanggaan yang pernah saya rasakan pada saat menghirup udara segar di tengah pemandangan yang luar biasa , juga tekstur dan presentasi makanan yang disajikan . saya appreciate sekali dengan pelayanan yang diberikan oleh waitress yang mantap .	positive
tadi pas makan malam saya ke sini , suasana restoran ini nyaman banget . saya mencoba nasi babi nasi putih 1 porsi , telor mata sapi setengah matang , kornet maling , lap chiong , ke kian , crispy sam can , sayur hijau , sambal rasanya secara keseluruhan enak . saya pesan minum lemon tea , lemon tea - nya segar rasanya . bbq pork rias nya , bumbu nya menyerap ke daging nya , rasa blackpepper nya kuat . sate samcan : rasanya sedikit pedas , garing .	positive
tempat nya mudah di jangkau oleh transportasi umum , terletak di sebelah jalan layang pasupati . tempat nya nyaman untuk keluarga , pasangan atau pun dengan teman di abuba steak porsi nya juga banyak , rasanya mantap steak nya juga empuk .	positive
buka jam 8 pagi anda bisa menikmani sarapan di sini . harga relatif lumayan . rasa lumayan bagi saya . pelayanan cepat . tempat bisa memuat 10 meja . anda harus mencoba menu mi bebek , itu menu direkomendasikan di sini	positive
kenken bigul kitchen ini merupakan resto yang menjual makanan non halal pertama yang saya coba di kota kembang . resto ini buka pada pukul 11 siang , namun ketika saya datang pukul 10.30 antrean nya sudah mengular . anda harus siap-siap untuk masuk daftar daftar tunggu apabila datang pada waktu-waktu primetime . saya mencoba babi panggang babi goreng serta ribu nya dan rasanya mantap .	positive
waktu itu ada acara makan malam dengan keluarga besar , pas datang suasana nya romantis banget . kalau datang nya malam c lebih cocok dengan pasangan x ya . hhaha . karena banyak lampu-lampu begitu sepanjang jalan , pesan nasi goreng , nasi goreng nya ditato didalem tempat nanas begitu , rasanya enak , hanya untuk harga nya agak lumayan ya . hai . yang paling tidak bakal lupa , pernah dikejar-kejar dengan pantomim nya .	positive
yang pasti saya sangat suka iga bakat superman nya , harga nya terbilang cukup mahal 80 ribu tapi dengan porsi yang sangat besar rasanya sangat layak dan bisa banget di makam untuk per 2 , tempat nya juga enak buat bawa anak karena ada tempat bermain area di depan kafe	positive
tempat yang berdampingan dengan air sungai dan rimbun nya pepohonan dan makanan yang lezat membuat betah dan cocok untuk beristirahat , berbagai jajanan juga tersedia di tempat ini , hawa nya juga sejuk .	positive
resto dessert ini menyediakan menu dessert yang sangat lengkap , rasa lumayan enak , harga sesuai kualitas makanan nya .	positive
mampir ke bandung , tepat nya di daerah sukajadi harus nyobain ramen di sini . tempat parkir yang luas , tempat makan yang ramai . di sini enak buat mengobrol santai . dan satu lagi thai itu nya enak .	positive
menurut saya soal rasa tidak istimewa , saus kacang nya juga biasa rasanya . masih ada batagor merk lain dengan harga yang jauh lebih murah namun rasa lebih enak . harga cukup mahal , 5 potong rp . 70 ribu desember 2015 .	positive
roti bakar dan bubur yang enak , sangat cocok bagi anda yang lapar di tengah malam karena cuti buka dari sore - pagi subuh tidak tahu persis nya .	positive
suasana nya di sini enak banget , tenang . kalau ke sini , memesan kue serabi nya . rasanya enak sekali . pelayanan di tempat ini bisa dibilang cukup lama dalam penyajian makanan	positive
sambal dengan daun serawung , tomat , dan cabe rawit . rasa sambal ini yang membuat kota di garut yang nama nya cibiuk jadi terkenal . sambal ini bisa dinikmati dengan gurame goreng ataupun dengan ayam goreng . rasanya sangat enak . selain di lengkokng cibiuk juga memiliki banyak cabang	positive
tidak kecewa	positive
waktu itu lagi lapor tapi tidak ingin makan , ya sudah akhirnya saya putuskan untuk ngemil di lareine kue roti , roti nya lengkap dengan varian rasa , cocok buat yang lapar tapi malas makan	positive
merayakan ulang tahun istri tercinta saya sengaja memilih tempat ini , terutama diruang di luar , suasana nyaman , tenang dan suara lift musik yang terdengar sayup-sayup terasa lebih mantap , tapi yang tidak kalah penting adalah makanan nya yang hampir rata-rata oke punya , saya sudah sangat sering berkunjung ketempat ini hampir semua makanan nya oke , hanya saja harga nya memang agak mahal he he he namun terbayar dengan yang didapatkan .	positive
diajak berwisata ke daerah lembang dari teman lokal bandung dan waktu makan siang lokasi nya di kampung daun . tempat nya luas dan sangat hijau , dilengkapi air terjun yang seperti air terjun alami , sangat menyenangkan untuk berkumpul dan menghabiskan waktu sambil menyantap makanan khas sunda yang enak !	positive
kalau di banyak tempat steak membutuhkan waktu lama sebelum penyajian nya , di tempat ini menurut saya cenderung cepat dan sesuai dengan lidah maupun dengan dompet saya . saya pernah menunggu teman sampai 2 jam di sini , tapi tidak berasa karena makanan nya membuat saya lupa waktu . hehe	positive
terbaik	positive
bandung terkenal dengan kuliner nya , jadi waktu ke bandung kemarin , saya browsing tempat makan pagi yang enak di bandung , dan bakmi naripan keluar sebagai salah satu yang direkomendasikan . buka jam 07:00 , dan dari pagi sudah ramai pengunjung . saya pesan mi asin babi , dan enak sekali . puas makan di sini , porsi cukup banyak . kalau ke bandung , boleh mencoba tempat ini untuk sarapan .	positive
terletak di lokasi yang jauh dari keramaian dan sejuk , sangat cocok untuk melepas penat . penataan lokasi yang khas , dengan tema alam : danau , saung , hutan dan sawah . yang paling unik adalah kafe yang berbentuk sarang burung terletak di antara pohon kayu putih , dan disambungkan dengan jembatan kayu sehingga kita akan merasakan sensasi makan yang lain . rasa makanan nya lumayan enak .	positive
jika anda ingin mearasakan indomie dengan cara yang berbeda , di sini tempat nya . favorit saya adalah mi ala upnormal . ada saus keju nya dan sedikit pedas . harga nya di bawah dua puluh ribu . saya juga biasa menambahkan toping telur mata sapi setengah matang . di sini cocok untuk mengerjakan tugas atau sekadar nongkrong .	positive
kami menginap di hotel trans dan coba the 18th resto trans . di sana menawarkan makan siang dan malam dengan pemandangan kota bandung yang indah . makanan yang ditawarkan kebanyakan westren makanan dan sedikit indonesia makanan . untuk minum ada wine dan minuman keras lainnya . kalau mau mencoba lebih indah pada malam hari dengan suasana remang-remang yang romantis dengan pemandangan lampu-lampu yang indah .	positive
saya rida datang ke restoran ini membawa keluarga dari makassar . restauran di pusat kota yang sangat menyenangkan . melihat pemandangan kota dari lantai 18 dan sky walk yang luar biasa cantik nya . steak salmon nya dan tahu isi nya enak pake banget . semua keluarga sangat senang . ala status sangat membantu sangat bagus , ramah-ramah dan sabar . layanan nya oke banget	positive
perpaduan nuansa mewah diiringi dengan live musik akustik berkelas menjadikan malam yang saya lalui begitu indah . beragam menu dapat dipilih di restorant menengah ke atas ini . bagi anda yang datang dengan pasangan pilihlah lantai atas di kesan pribadi dengan pemandangan kota dan lampu-lampu cantik menjadi daya tarik bagi kota bandung . sementara lantai bawah cocok bagi pengunjung yang ingin berbaur .	positive
tempat nya pas di jantung nya bandung . di tengah keramaian jalan riau . capek capek ke fo bisa makan di daken . ini kayak rumah . karena memang bekas rumah yang dijadikan kafe . tempat nya nyaman , makanan nya enak juga . dari steak , nasi goreng dan cream sup nya enak . porsi nya cukup besar dengan penyajian di piring besar juga . :	positive
salah satu foodcourt terbesar di bandung . lokasi di dekat hotel hilton . nyaman untuk bersantai dengan keluarga . makanan sangat bervariasi dan harga terjangkau . rekomendasi tempat .	positive
the restoran tempat yang pas buat romantis makan malam . makanan nya enak , pemandangan nya bagus , lagu yang mengalun juga easy listening dan yang pasti bagus services . terima kasih ms . tisna .	positive
berkali-kali saya makan di resto ini hanya menu sarapan saat saya menginap di the valley resort . namun akhirnya pada november 2013 saya berkesempatan menyicipi menu main course nya . acara kantor dan dipersilakan untuk memesan wagyu yang paling mahal . kesalahan nya adalah , acara nya direschedule dari jam 9 malam dimajukan ke jam 6 . sedangkan jam 3 kami baru sempat makan siang .	positive
saya berkunjung ke restoran ini sekitar jam 4 sore hari . saya datang bersama 2 orang teman saya , kami mengambil meja makan yang berada di dalam saung . kami memesan nasi tutug oncom , nasi timbel komplit spesial , dan berbagai macam gorengan . restoran ini menyediakan berbagai macam pilihan sambal yang dapat kita ambil sendiri tergantung kepada selera lidah kita .	positive
tempat makan yang sejuk , suasana nya menyenangkan . jenis masakan sunda tradisional . untuk rasa cukup lumayan . tempat makan lesehan dibuat dalam pondokan dengan nuansa alam , ada air terjun kecil juga disebelah atas .	positive
baru sekali ke sini dan mau balik lagi tapi belum ada kesempatan , karena tempat nya lumayan jauh dan kalau lagi peak season jalanan nya macet banget . triliun . triliun tempat nya enak , sejuk banget plus ada kebun stroberi juga jadi kita bisa sekalian wisata petik . makanan nya rekomendasi sekali terutama nasi liwet nya yang belum pernah seenak di sini . wajib dicoba kalau ke lembang . cinta ini tempat jadi . lanjutan	positive
ayam goreng suharti dari dulu memang enak sekali , saya dan keluarga setiap ke bandung pasti ke tempat ini . karena ayam nya enak lunak dan garing . di sini juga tersedia bermacam-macam menu ada gudeg bacem dll.	positive
enak pedas nya juga enak banget tapi yang jual sedikit-sedikit judes : p tapi di banding bakmi-bakmi lainnya yang terkenal2 itu bakmi bar dan saya lebih suka ini , give it a dicoba	positive
dari segi tempat mungkin sangat sederhana , tapi rasa tidak perlu diragukan lagi . harga nya pun cukup terjangkau . kekurangan nya harus sabar antre dan panas-panasan menunggu giliran .	positive
tidak pernah bosan datang ke sini baik siang maupun malam hari untuk sekadar menikmati keindahan tempat yang ada di kampung daun ini . konsep yang sangat pas sekali dengan nuansa jawa barat yang asri dan tenang membuat kita betah berlama-lama di sini . makanan yang dihidangkan sangat beragam dengan cita rasa yang sunda banget .	positive
terima kasih id buat puso nya ! baru saja dapat di	positive
makanan siap saji ini ya kfc menawarkan ciri khas ayam yang renyah dan gurih . selain ayam ada juga beragam jenis minuman yang khas seperti es krim apung yang dipadukan dengan sirop serta topping jelly yang kenyal . ada juga makan pelengkap lainnya , burger , kentang gireng dll. restoran makanan untuk sarapan salah satu nya adalah bubur dan bagi anda pecinta kopi pun tentunya .	positive
makan di tempat ini pasti kenyang sekali , pasalnya yang biasanya ukuran tempura kecil-kecil , ini besar . jadi puas sekali makan nya . dan lagi sangat murah banget . serta ada juga menu ni ku udon yang rasanya gurih agak asin sedikit .	positive
porsi besar , pelayan nya cowok semua , kalau cuaca mendukung lebih baik pilih seat di luar pemandangan nya kota bandung cakap juga kalau malam , kalau rintik-rintik ya lebih baik di dalam karena ada iringan piano , bukan organ tungal loh ,	positive
saya bersama teman saya datang ke sini untuk acara arisan . tempat nya nyaman dan berkonsep minimalis , sangat cocok untuk nongkrong dan bersantai dengan teman-teman . saya memesan menu favorit saya yaitu aglio olio tuna dan ice tea . rasanya oke , seperti kafe sejenis lainnya .	positive
tempat makan yang unik . menu dan rasanya top banget sesuai dengan harga nya , suasana yang sejuk dan tempat makan membuat betah dan enggan beranjak .	positive
kejahatan yang datang pada jokowi dibalas kebaikan dengan pak jokowi	positive
saya mendapat referensi dari teman saya mengenai ayam goreng nikmat yang kabar nya enak . rumah makan ayam goreng nikmat ini terletak di jalan panaitan , yang ditempuh melalui melalui jalan sunda . lokasi nya lumayan nyaman , rumah makan nya terbuka dengan meja dan kursi panjang . ayam goreng nya memang nikmat , walaupun harga nya agak pricey rp . 21,000 . - terpotong . menu lain yang kami coba adalah nasi bakar , tahu dan tempe . mantap . top .	positive
interior nya sederhana tempat duduk nya ada 2 macam lesehan dengan tikar dan bangku kayu alat makan nya menggunakan piring dan gelas kaleng seperti zaman dulu . makanan nya sudah matang kita tinggal memilih saja sesuai selera mulai dari ayam goreng bakar , pepes , sayuran terong , gorengan , kue , es goyang dan lain-lain sambal dan lalapan nya juga lengkap betul betul resto masakan sunda yang patut untuk dikunjungi .	positive
makan suki di braga bandung , sup tom yam nya segar , makan suki sampai puas bersama keluarga , milkshake vanila nya juga enak anak-anak suka	positive
terima kasih walaupun delay tetapi saya sangat puas dengan servis dari flight attendant nya yang baik dan ramah . saya jadi tidak kesal atau pun marah karena delay .	positive
untuk kesekian kalinya makan siang di lotek kalipah apo , biasanya pesan lotek yang rasanya mantap dan selalu ludes tak bersisa , tapi kemarin itu ingin mencoba gado gado nya dan karena dari pagi belum makan maka pesan gado-gado nya pake lontong ditambah kolak pula dan ternyata porsi nya banyak banget itu gado-gado sampai perut rasanya enak banget ditambah kolak yang rasanya legit . tapi akhirnya habis juga karena enak .	positive
negeri ini dibangun dengan pikiran yang bagus oleh para pendiri bangsa .	positive
the kiosk menurut saya adalah food court yang memiliki konsep menarik . berbagai makanan khas bandung tersedia di sini , dan favorit saya adalah mie kocok dan sate hadori . harga nya cukup terjangkau dan lumayan bersih .	positive
rumah makan sunda dengan seabreg menu yang menurut saya enak banget apalagi semur jengkol nya . menu nya banyak pilihan dan tempat nya enak , akses nya juga mudah	positive
hasil keringat mu besok , tidak akan terbuang sia-sia	positive
ketika saya berkunjung ke istana plaza , pulang nya saya melewati jalan dari . radjiman . saya terkejut dikarenakan saya melihat bunga buka di bandung . saya baru tahu mengenai hal ini . karena memang saya sedang menghadap untuk makan barbeque korea , saya pun mengajak teman saya untuk makan malam di tempat ini . temapt nya oke karena terang dan terlihat baru . jarak antara meja pun luas sehingga kita . lanjutan	positive
sumpah kagum banget sama isi otak pak habibie	positive
menu yang sudah saya coba nasi bakmoy , bakut sayur asin , rujak uleg dan es cingcau , semuanya enak ! harga nya juga murah banget . kekurangan nya cuma di meja makan nya kurang banyak , jadi di waktu makan bisa tidak kebagian tempat .	positive
harus banget nyobain kopi sanger nya ! sanger itu kepanjangan dari saling mengerti antara kamu dengan sang barista . tinggal bilang mau panas atau dingin , pahit atau manis , dan voila ! kopi akan datang tepat dengan rasa yang kamu inginkan ! kopi sanger juga disajikan dengan berbagai tambahan rasa seperti nutela , milo , ovaltine , dan avocado . pas banget kalau kamu datang ke sini malam hari .	positive
kami pesan sop buntut goreng . seperti bumbu dengan kuah yang tidak terlalu berminyak . hanya satu waktu penyajian lumayan lama , lebih dari 10 menit . sebaiknya datang saat belum terlalu lapar atau anda akan emosi seperti saya yang harus menanyakan beberapa kali kapan pesanan anda terhidang	positive
terletak di dalam trans studio mal , gatot subroto lantai 2 , bandung . menutenderloin steak nya lezat dan empuk , porsi sedang . sedang daging cordonbleu nya terlalu banyak tepung , porsi lebih kecil . burger steak nya oke juga dilengkapi dengan salad yang segar . harga rata rata lokal steak sekitar 50k . disajikan dengan gratis 1 pitcher air putih	positive
perjalanan ke kafe dipakar cukup sulit medan - nya , sangat direkomendasikan menggunakan sepeda motor atau non city - car . nuansa di lokasi sangat indah , pemandangan pegunungan dengan kesegaran alam , pas untuk berfoto ria . untuk makanan dan minuman , secara rasa standar saja , pesan nasi bakar nya yang khas dan meskipun secara porsi kurang mengenyangkan , harus tambah cemilan lagi biar pas kenyang - nya	positive
menurut saya di tempat ini soerabi nya agak kecil , rasanya standard , tapi mahal . topping nya juga lebih sedikit apabila dibandingkan dengan warung soerabi	positive
saya mengetahui restoran ini dari website nya yang mengatakan bahwa mereka telah melayani sejak zaman kolonial belanda . pada kunjungan sebelumnya , saya tidak berkesempatan makan di restoran ini karena penuh . kali ini saya berksempatan makan karena saat itu minggu sore . saya memesan triliun bone steak , dan nasi goreng . t bone steak nya tidak terlalu enak , daging nya agak keras . nasi goreng nya enak .	positive
dari luar saja sudah tercium wangi pepes ayam , jeroan , peuteuy , jengkol , sambal plus liwet , pas masuk kedalemmm wah mata langsung belanja deh , makanan sunda kebanyakan ada di sini nih ,,! semua disajikan buffet tapi kalau ada yang ingin di hangatkan minta saja ada kok abang-abang atau teteh2 yang jagain kuali gede nya yang siap mengagetkan apa saja pesanan kita : d	positive
ini adalah resto yang menyajikan daging babi . penggemar mi pedas pasti ketagihan mi rica nya yang super aduhai pedas . yang tidak ingin pedas , bisa pesan mie lain seperti mi samcan . jangan lupa cicipi bakso udang goreng , langsung disajikan panas dan renyah .	positive
